{
  "boundary_record_id": "urn:uuid:5ac9b67a-4438-5c8b-8aab-9b567c604cb4",
  "entry_digest": "sha256:3a91b1caab0d5a2205b522ba841da12e588df65dd4b4e5e647da7e9f12723362",
  "entry_id": "urn:uuid:550bd37a-95ea-5e62-8df5-916c5b55eb30",
  "extensions": {
    "lorebuddy-dnd2024-review": {
      "digest_semantics": "raw selected bytes under executable core.source-fragment@0.1.0 schema; not source-fragment-events protocol",
      "full_fidelity_claim": false,
      "selection": "whole raw entry audit envelope; not a fine-grained rule boundary"
    }
  },
  "fragment_digest": "sha256:3a91b1caab0d5a2205b522ba841da12e588df65dd4b4e5e647da7e9f12723362",
  "id": "urn:uuid:a6cb8fb7-ab28-5156-b9b5-c10a75688a58",
  "lifecycle": {
    "revision": 1,
    "status": "draft"
  },
  "locator": {
    "end": 48881,
    "kind": "byte-range",
    "parser": "raw-bytes-no-parser@1",
    "start": 0
  },
  "schema": "core.source-fragment@0.1.0",
  "source_mapping_ids": [
    "urn:uuid:2b6584ea-16ab-541e-93e1-a63ae63c1dad"
  ]
}
